"num","time","src","dest","protocol","length","info","src_port","dest_port","src_ip","dest_ip","hardware_src_addr","hardware_dst_addr","set"
"4","0.325894","DN0a226530.SUNet","lax17s02-in-f4.1e100.net","TCP","54","50735  >  https [FIN, ACK] Seq=1 Ack=1 Win=255 Len=0","50735","443","10.34.101.48","172.217.1.228","10.34.101.48","00:00:0c:07:ac:37","NYTimes"
"5","0.325956","DN0a226530.SUNet","lax17s02-in-f4.1e100.net","TCP","54","50735  >  https [RST, ACK] Seq=2 Ack=1 Win=0 Len=0","50735","443","10.34.101.48","172.217.1.228","10.34.101.48","00:00:0c:07:ac:37","NYTimes"
"6","0.326101","DN0a226530.SUNet","lax17s02-in-f4.1e100.net","TCP","54","50733  >  https [FIN, ACK] Seq=1 Ack=1 Win=255 Len=0","50733","443","10.34.101.48","172.217.1.228","10.34.101.48","00:00:0c:07:ac:37","NYTimes"
"7","0.326138","DN0a226530.SUNet","lax17s02-in-f4.1e100.net","TCP","54","50733  >  https [RST, ACK] Seq=2 Ack=1 Win=0 Len=0","50733","443","10.34.101.48","172.217.1.228","10.34.101.48","00:00:0c:07:ac:37","NYTimes"
"9","0.843976","DN0a226530.SUNet","iron.stanford.edu","DNS","85","Standard query 0x5df7 PTR 233.96.34.10.in-addr.arpa","54461","53","10.34.101.48","171.67.1.234","10.34.101.48","00:00:0c:07:ac:37","NYTimes"
"10","0.844128","DN0a226530.SUNet","iron.stanford.edu","DNS","84","Standard query 0x284b PTR 252.0.0.224.in-addr.arpa","54461","53","10.34.101.48","171.67.1.234","10.34.101.48","00:00:0c:07:ac:37","NYTimes"
"11","0.844246","DN0a226530.SUNet","iron.stanford.edu","DNS","85","Standard query 0x8f47 PTR 113.99.34.10.in-addr.arpa","54461","53","10.34.101.48","171.67.1.234","10.34.101.48","00:00:0c:07:ac:37","NYTimes"
"12","0.844340","DN0a226530.SUNet","iron.stanford.edu","DNS","88","Standard query 0xadc9 PTR 250.255.255.239.in-addr.arpa","54461","53","10.34.101.48","171.67.1.234","10.34.101.48","00:00:0c:07:ac:37","NYTimes"
"13","0.844443","DN0a226530.SUNet","iron.stanford.edu","DNS","84","Standard query 0xcb44 PTR 60.96.34.10.in-addr.arpa","54461","53","10.34.101.48","171.67.1.234","10.34.101.48","00:00:0c:07:ac:37","NYTimes"
"14","0.844535","DN0a226530.SUNet","iron.stanford.edu","DNS","82","Standard query 0x9845 PTR 1.0.0.224.in-addr.arpa","54461","53","10.34.101.48","171.67.1.234","10.34.101.48","00:00:0c:07:ac:37","NYTimes"
"15","0.844625","DN0a226530.SUNet","iron.stanford.edu","DNS","85","Standard query 0x51d6 PTR 48.101.34.10.in-addr.arpa","54461","53","10.34.101.48","171.67.1.234","10.34.101.48","00:00:0c:07:ac:37","NYTimes"
"16","0.844712","DN0a226530.SUNet","iron.stanford.edu","DNS","86","Standard query 0x6195 PTR 228.1.217.172.in-addr.arpa","54461","53","10.34.101.48","171.67.1.234","10.34.101.48","00:00:0c:07:ac:37","NYTimes"
"17","0.865874","iron.stanford.edu","DN0a226530.SUNet","DNS","277","Standard query response 0x5df7 PTR 233.96.34.10.in-addr.arpa PTR DN0a2260e9.SUNet NS ice.stanford.edu NS iron.stanford.edu A 171.64.1.234 AAAA 2607:f6d0:0:53::64:53 A 171.67.1.234 AAAA 2607:f6d0:0:53::67:53","53","54461","171.67.1.234","10.34.101.48","CiscoInc_ec:08:00","a0:a8:cd:44:9e:6d","NYTimes"
"18","0.865878","iron.stanford.edu","DN0a226530.SUNet","DNS","141","Standard query response 0x284b No such name PTR 252.0.0.224.in-addr.arpa SOA sns.dns.icann.org","53","54461","171.67.1.234","10.34.101.48","CiscoInc_ec:08:00","a0:a8:cd:44:9e:6d","NYTimes"
"19","0.865878","iron.stanford.edu","DN0a226530.SUNet","DNS","277","Standard query response 0x8f47 PTR 113.99.34.10.in-addr.arpa PTR DN0a226371.SUNet NS iron.stanford.edu NS ice.stanford.edu A 171.64.1.234 AAAA 2607:f6d0:0:53::64:53 A 171.67.1.234 AAAA 2607:f6d0:0:53::67:53","53","54461","171.67.1.234","10.34.101.48","CiscoInc_ec:08:00","a0:a8:cd:44:9e:6d","NYTimes"
"20","0.865879","iron.stanford.edu","DN0a226530.SUNet","DNS","145","Standard query response 0xadc9 No such name PTR 250.255.255.239.in-addr.arpa SOA sns.dns.icann.org","53","54461","171.67.1.234","10.34.101.48","CiscoInc_ec:08:00","a0:a8:cd:44:9e:6d","NYTimes"
"21","0.876392","iron.stanford.edu","DN0a226530.SUNet","DNS","275","Standard query response 0xcb44 PTR 60.96.34.10.in-addr.arpa PTR DN0a22603c.SUNet NS ice.stanford.edu NS iron.stanford.edu A 171.64.1.234 AAAA 2607:f6d0:0:53::64:53 A 171.67.1.234 AAAA 2607:f6d0:0:53::67:53","53","54461","171.67.1.234","10.34.101.48","CiscoInc_ec:08:00","a0:a8:cd:44:9e:6d","NYTimes"
"22","0.879337","iron.stanford.edu","DN0a226530.SUNet","DNS","380","Standard query response 0x9845 PTR 1.0.0.224.in-addr.arpa PTR all-systems.mcast.net NS c.iana-servers.net NS a.iana-servers.net NS b.iana-servers.net NS ns.icann.org A 199.43.135.53 AAAA 2001:500:8f::53 A 199.43.133.53 AAAA 2001:500:8d::53 A 199.43.134.53 AAAA 2001:500:8e::53 A 199.4.138.53 AAAA 2001:500:89::53","53","54461","171.67.1.234","10.34.101.48","CiscoInc_ec:08:00","a0:a8:cd:44:9e:6d","NYTimes"
"23","0.879337","iron.stanford.edu","DN0a226530.SUNet","DNS","277","Standard query response 0x51d6 PTR 48.101.34.10.in-addr.arpa PTR DN0a226530.SUNet NS iron.stanford.edu NS ice.stanford.edu A 171.64.1.234 AAAA 2607:f6d0:0:53::64:53 A 171.67.1.234 AAAA 2607:f6d0:0:53::67:53","53","54461","171.67.1.234","10.34.101.48","CiscoInc_ec:08:00","a0:a8:cd:44:9e:6d","NYTimes"
"24","0.879339","iron.stanford.edu","DN0a226530.SUNet","DNS","270","Standard query response 0x6195 PTR 228.1.217.172.in-addr.arpa PTR lax17s02-in-f4.1e100.net NS ns4.google.com NS ns1.google.com NS ns3.google.com NS ns2.google.com A 216.239.32.10 A 216.239.34.10 A 216.239.36.10 A 216.239.38.10","53","54461","171.67.1.234","10.34.101.48","CiscoInc_ec:08:00","a0:a8:cd:44:9e:6d","NYTimes"
"33","1.636072","DN0a226530.SUNet","224.0.0.252","IGMPv2","46","Membership Report group 224.0.0.252","","","10.34.101.48","224.0.0.252","10.34.101.48","01:00:5e:00:00:fc","NYTimes"
"34","1.636112","DN0a226530.SUNet","239.255.255.250","IGMPv2","46","Membership Report group 239.255.255.250","","","10.34.101.48","239.255.255.250","10.34.101.48","01:00:5e:7f:ff:fa","NYTimes"
"36","1.840616","DN0a226530.SUNet","iron.stanford.edu","DNS","86","Standard query 0x913e PTR 111.104.34.10.in-addr.arpa","54461","53","10.34.101.48","171.67.1.234","10.34.101.48","00:00:0c:07:ac:37","NYTimes"
"37","1.840748","DN0a226530.SUNet","iron.stanford.edu","DNS","85","Standard query 0x7293 PTR 234.1.67.171.in-addr.arpa","54461","53","10.34.101.48","171.67.1.234","10.34.101.48","00:00:0c:07:ac:37","NYTimes"
"38","1.840841","DN0a226530.SUNet","iron.stanford.edu","DNS","86","Standard query 0xdfcd PTR 105.105.34.10.in-addr.arpa","54461","53","10.34.101.48","171.67.1.234","10.34.101.48","00:00:0c:07:ac:37","NYTimes"
"39","1.842868","iron.stanford.edu","DN0a226530.SUNet","DNS","279","Standard query response 0x913e PTR 111.104.34.10.in-addr.arpa PTR DN0a22686f.SUNet NS iron.stanford.edu NS ice.stanford.edu A 171.64.1.234 AAAA 2607:f6d0:0:53::64:53 A 171.67.1.234 AAAA 2607:f6d0:0:53::67:53","53","54461","171.67.1.234","10.34.101.48","CiscoInc_ec:08:00","a0:a8:cd:44:9e:6d","NYTimes"
"40","1.844355","iron.stanford.edu","DN0a226530.SUNet","DNS","337","Standard query response 0x7293 PTR 234.1.67.171.in-addr.arpa PTR iron-4.stanford.edu NS avallone.stanford.edu NS atalante.stanford.edu NS argus.stanford.edu A 171.64.7.115 AAAA 2607:f6d0:0:9113::ab40:773 A 171.64.7.61 AAAA 2607:f6d0:0:d32::ab40:73d A 204.63.227.77","53","54461","171.67.1.234","10.34.101.48","CiscoInc_ec:08:00","a0:a8:cd:44:9e:6d","NYTimes"
"41","1.844355","iron.stanford.edu","DN0a226530.SUNet","DNS","279","Standard query response 0xdfcd PTR 105.105.34.10.in-addr.arpa PTR DN0a226969.SUNet NS iron.stanford.edu NS ice.stanford.edu A 171.64.1.234 AAAA 2607:f6d0:0:53::64:53 A 171.67.1.234 AAAA 2607:f6d0:0:53::67:53","53","54461","171.67.1.234","10.34.101.48","CiscoInc_ec:08:00","a0:a8:cd:44:9e:6d","NYTimes"
"52","2.619561","DN0a226530.SUNet","ec2-54-69-167-143.us-west-2.compute.amazonaws.com","TCP","66","50817  >  http [SYN] Seq=0 Win=8192 Len=0 MSS=1460 WS=256 SACK_PERM=1","50817","80","10.34.101.48","54.69.167.143","10.34.101.48","00:00:0c:07:ac:37","NYTimes"
"53","2.619654","DN0a226530.SUNet","ice.stanford.edu","DNS","89","Standard query 0xc245 A d3cxgjorprur2q.cloudfront.net","64107","53","10.34.101.48","171.64.1.234","10.34.101.48","00:00:0c:07:ac:37","NYTimes"
"54","2.619801","DN0a226530.SUNet","ec2-54-69-167-143.us-west-2.compute.amazonaws.com","TCP","66","50818  >  http [SYN] Seq=0 Win=8192 Len=0 MSS=1460 WS=256 SACK_PERM=1","50818","80","10.34.101.48","54.69.167.143","10.34.101.48","00:00:0c:07:ac:37","NYTimes"
"55","2.620007","DN0a226530.SUNet","pagead.l.doubleclick.net","TCP","66","50819  >  http [SYN] Seq=0 Win=8192 Len=0 MSS=1460 WS=256 SACK_PERM=1","50819","80","10.34.101.48","172.217.3.226","10.34.101.48","00:00:0c:07:ac:37","NYTimes"
"56","2.620251","DN0a226530.SUNet","ec2-23-23-248-17.compute-1.amazonaws.com","TCP","66","50820  >  http [SYN] Seq=0 Win=8192 Len=0 MSS=1460 WS=256 SACK_PERM=1","50820","80","10.34.101.48","23.23.248.17","10.34.101.48","00:00:0c:07:ac:37","NYTimes"
"57","2.620356","DN0a226530.SUNet","ec2-23-23-248-17.compute-1.amazonaws.com","TCP","66","50821  >  http [SYN] Seq=0 Win=8192 Len=0 MSS=1460 WS=256 SACK_PERM=1","50821","80","10.34.101.48","23.23.248.17","10.34.101.48","00:00:0c:07:ac:37","NYTimes"
"58","2.620361","DN0a226530.SUNet","ice.stanford.edu","DNS","76","Standard query 0xf170 A s3.amazonaws.com","64878","53","10.34.101.48","171.64.1.234","10.34.101.48","00:00:0c:07:ac:37","NYTimes"
"59","2.620528","DN0a226530.SUNet","nuq04s29-in-f1.1e100.net","TCP","66","50822  >  http [SYN] Seq=0 Win=8192 Len=0 MSS=1460 WS=256 SACK_PERM=1","50822","80","10.34.101.48","216.58.192.1","10.34.101.48","00:00:0c:07:ac:37","NYTimes"
"60","2.620631","DN0a226530.SUNet","nuq04s29-in-f1.1e100.net","TCP","66","50823  >  http [SYN] Seq=0 Win=8192 Len=0 MSS=1460 WS=256 SACK_PERM=1","50823","80","10.34.101.48","216.58.192.1","10.34.101.48","00:00:0c:07:ac:37","NYTimes"
"61","2.620863","DN0a226530.SUNet","nuq04s29-in-f1.1e100.net","TCP","66","50824  >  http [SYN] Seq=0 Win=8192 Len=0 MSS=1460 WS=256 SACK_PERM=1","50824","80","10.34.101.48","216.58.192.1","10.34.101.48","00:00:0c:07:ac:37","NYTimes"
"62","2.620969","DN0a226530.SUNet","nuq04s29-in-f1.1e100.net","TCP","66","50825  >  http [SYN] Seq=0 Win=8192 Len=0 MSS=1460 WS=256 SACK_PERM=1","50825","80","10.34.101.48","216.58.192.1","10.34.101.48","00:00:0c:07:ac:37","NYTimes"
"63","2.621067","DN0a226530.SUNet","nuq04s29-in-f1.1e100.net","TCP","66","50826  >  http [SYN] Seq=0 Win=8192 Len=0 MSS=1460 WS=256 SACK_PERM=1","50826","80","10.34.101.48","216.58.192.1","10.34.101.48","00:00:0c:07:ac:37","NYTimes"
"64","2.621407","DN0a226530.SUNet","e5482.g.akamaiedge.net","TCP","66","50827  >  https [SYN] Seq=0 Win=8192 Len=0 MSS=1460 WS=256 SACK_PERM=1","50827","443","10.34.101.48","23.192.98.237","10.34.101.48","00:00:0c:07:ac:37","NYTimes"
"65","2.621518","DN0a226530.SUNet","e5482.g.akamaiedge.net","TCP","66","50828  >  https [SYN] Seq=0 Win=8192 Len=0 MSS=1460 WS=256 SACK_PERM=1","50828","443","10.34.101.48","23.192.98.237","10.34.101.48","00:00:0c:07:ac:37","NYTimes"
"66","2.621620","DN0a226530.SUNet","e5482.g.akamaiedge.net","TCP","66","50829  >  https [SYN] Seq=0 Win=8192 Len=0 MSS=1460 WS=256 SACK_PERM=1","50829","443","10.34.101.48","23.192.98.237","10.34.101.48","00:00:0c:07:ac:37","NYTimes"
"67","2.621788","DN0a226530.SUNet","e5482.g.akamaiedge.net","TCP","66","50830  >  https [SYN] Seq=0 Win=8192 Len=0 MSS=1460 WS=256 SACK_PERM=1","50830","443","10.34.101.48","23.192.98.237","10.34.101.48","00:00:0c:07:ac:37","NYTimes"
"68","2.621894","DN0a226530.SUNet","e5482.g.akamaiedge.net","TCP","66","50831  >  https [SYN] Seq=0 Win=8192 Len=0 MSS=1460 WS=256 SACK_PERM=1","50831","443","10.34.101.48","23.192.98.237","10.34.101.48","00:00:0c:07:ac:37","NYTimes"
"69","2.621999","DN0a226530.SUNet","e5482.g.akamaiedge.net","TCP","66","50832  >  https [SYN] Seq=0 Win=8192 Len=0 MSS=1460 WS=256 SACK_PERM=1","50832","443","10.34.101.48","23.192.98.237","10.34.101.48","00:00:0c:07:ac:37","NYTimes"
"70","2.622154","DN0a226530.SUNet","ec2-52-87-200-50.compute-1.amazonaws.com","TCP","66","50833  >  https [SYN] Seq=0 Win=8192 Len=0 MSS=1460 WS=256 SACK_PERM=1","50833","443","10.34.101.48","52.87.200.50","10.34.101.48","00:00:0c:07:ac:37","NYTimes"
"71","2.622261","DN0a226530.SUNet","ec2-52-87-200-50.compute-1.amazonaws.com","TCP","66","50834  >  https [SYN] Seq=0 Win=8192 Len=0 MSS=1460 WS=256 SACK_PERM=1","50834","443","10.34.101.48","52.87.200.50","10.34.101.48","00:00:0c:07:ac:37","NYTimes"
"72","2.623064","ice.stanford.edu","DN0a226530.SUNet","DNS","436","Standard query response 0xc245 A d3cxgjorprur2q.cloudfront.net A 52.84.22.220 A 52.84.22.79 A 52.84.22.145 A 52.84.22.190 A 52.84.22.56 A 52.84.22.21 A 52.84.22.102 A 52.84.22.236 NS ns-1839.awsdns-37.co.uk NS ns-1272.awsdns-31.org NS ns-457.awsdns-57.com NS ns-611.awsdns-12.net A 205.251.193.201 A 205.251.194.99 A 205.251.196.248 A 205.251.199.47","53","64107","171.64.1.234","10.34.101.48","CiscoInc_ec:08:00","a0:a8:cd:44:9e:6d","NYTimes"
"73","2.623573","DN0a226530.SUNet","d3cxgjorprur2q.cloudfront.net","TCP","66","50835  >  http [SYN] Seq=0 Win=8192 Len=0 MSS=1460 WS=256 SACK_PERM=1","50835","80","10.34.101.48","52.84.22.220","10.34.101.48","00:00:0c:07:ac:37","NYTimes"
"74","2.623695","DN0a226530.SUNet","d3cxgjorprur2q.cloudfront.net","TCP","66","50836  >  http [SYN] Seq=0 Win=8192 Len=0 MSS=1460 WS=256 SACK_PERM=1","50836","80","10.34.101.48","52.84.22.220","10.34.101.48","00:00:0c:07:ac:37","NYTimes"
"75","2.623794","DN0a226530.SUNet","d3cxgjorprur2q.cloudfront.net","TCP","66","50837  >  http [SYN] Seq=0 Win=8192 Len=0 MSS=1460 WS=256 SACK_PERM=1","50837","80","10.34.101.48","52.84.22.220","10.34.101.48","00:00:0c:07:ac:37","NYTimes"
"76","2.623878","pagead.l.doubleclick.net","DN0a226530.SUNet","TCP","66","http  >  50819 [SYN, ACK] Seq=0 Ack=1 Win=42900 Len=0 MSS=1430 SACK_PERM=1 WS=128","80","50819","172.217.3.226","10.34.101.48","CiscoInc_ec:08:00","a0:a8:cd:44:9e:6d","NYTimes"
"77","2.623891","DN0a226530.SUNet","d3cxgjorprur2q.cloudfront.net","TCP","66","50838  >  http [SYN] Seq=0 Win=8192 Len=0 MSS=1460 WS=256 SACK_PERM=1","50838","80","10.34.101.48","52.84.22.220","10.34.101.48","00:00:0c:07:ac:37","NYTimes"
"78","2.623925","DN0a226530.SUNet","pagead.l.doubleclick.net","TCP","54","50819  >  http [ACK] Seq=1 Ack=1 Win=65536 Len=0","50819","80","10.34.101.48","172.217.3.226","10.34.101.48","00:00:0c:07:ac:37","NYTimes"
"79","2.623997","DN0a226530.SUNet","d3cxgjorprur2q.cloudfront.net","TCP","66","50839  >  http [SYN] Seq=0 Win=8192 Len=0 MSS=1460 WS=256 SACK_PERM=1","50839","80","10.34.101.48","52.84.22.220","10.34.101.48","00:00:0c:07:ac:37","NYTimes"
"80","2.624094","DN0a226530.SUNet","d3cxgjorprur2q.cloudfront.net","TCP","66","50840  >  http [SYN] Seq=0 Win=8192 Len=0 MSS=1460 WS=256 SACK_PERM=1","50840","80","10.34.101.48","52.84.22.220","10.34.101.48","00:00:0c:07:ac:37","NYTimes"
"81","2.628820","nuq04s29-in-f1.1e100.net","DN0a226530.SUNet","TCP","66","http  >  50822 [SYN, ACK] Seq=0 Ack=1 Win=42900 Len=0 MSS=1430 SACK_PERM=1 WS=128","80","50822","216.58.192.1","10.34.101.48","CiscoInc_ec:08:00","a0:a8:cd:44:9e:6d","NYTimes"
"82","2.628821","nuq04s29-in-f1.1e100.net","DN0a226530.SUNet","TCP","66","http  >  50824 [SYN, ACK] Seq=0 Ack=1 Win=42900 Len=0 MSS=1430 SACK_PERM=1 WS=128","80","50824","216.58.192.1","10.34.101.48","CiscoInc_ec:08:00","a0:a8:cd:44:9e:6d","NYTimes"
"83","2.628822","nuq04s29-in-f1.1e100.net","DN0a226530.SUNet","TCP","66","http  >  50825 [SYN, ACK] Seq=0 Ack=1 Win=42900 Len=0 MSS=1430 SACK_PERM=1 WS=128","80","50825","216.58.192.1","10.34.101.48","CiscoInc_ec:08:00","a0:a8:cd:44:9e:6d","NYTimes"
"84","2.628822","nuq04s29-in-f1.1e100.net","DN0a226530.SUNet","TCP","66","http  >  50826 [SYN, ACK] Seq=0 Ack=1 Win=42900 Len=0 MSS=1430 SACK_PERM=1 WS=128","80","50826","216.58.192.1","10.34.101.48","CiscoInc_ec:08:00","a0:a8:cd:44:9e:6d","NYTimes"
"85","2.628823","nuq04s29-in-f1.1e100.net","DN0a226530.SUNet","TCP","66","http  >  50823 [SYN, ACK] Seq=0 Ack=1 Win=42900 Len=0 MSS=1430 SACK_PERM=1 WS=128","80","50823","216.58.192.1","10.34.101.48","CiscoInc_ec:08:00","a0:a8:cd:44:9e:6d","NYTimes"
"86","2.628823","e5482.g.akamaiedge.net","DN0a226530.SUNet","TCP","66","https  >  50827 [SYN, ACK] Seq=0 Ack=1 Win=29200 Len=0 MSS=1460 SACK_PERM=1 WS=32","443","50827","23.192.98.237","10.34.101.48","CiscoInc_ec:08:00","a0:a8:cd:44:9e:6d","NYTimes"
"87","2.628824","e5482.g.akamaiedge.net","DN0a226530.SUNet","TCP","66","https  >  50829 [SYN, ACK] Seq=0 Ack=1 Win=29200 Len=0 MSS=1460 SACK_PERM=1 WS=32","443","50829","23.192.98.237","10.34.101.48","CiscoInc_ec:08:00","a0:a8:cd:44:9e:6d","NYTimes"
"88","2.629413","DN0a226530.SUNet","nuq04s29-in-f1.1e100.net","TCP","54","50822  >  http [ACK] Seq=1 Ack=1 Win=65536 Len=0","50822","80","10.34.101.48","216.58.192.1","10.34.101.48","00:00:0c:07:ac:37","NYTimes"
"89","2.629674","DN0a226530.SUNet","nuq04s29-in-f1.1e100.net","TCP","54","50824  >  http [ACK] Seq=1 Ack=1 Win=65536 Len=0","50824","80","10.34.101.48","216.58.192.1","10.34.101.48","00:00:0c:07:ac:37","NYTimes"
"90","2.629727","DN0a226530.SUNet","nuq04s29-in-f1.1e100.net","TCP","54","50825  >  http [ACK] Seq=1 Ack=1 Win=65536 Len=0","50825","80","10.34.101.48","216.58.192.1","10.34.101.48","00:00:0c:07:ac:37","NYTimes"
"91","2.629774","DN0a226530.SUNet","nuq04s29-in-f1.1e100.net","TCP","54","50826  >  http [ACK] Seq=1 Ack=1 Win=65536 Len=0","50826","80","10.34.101.48","216.58.192.1","10.34.101.48","00:00:0c:07:ac:37","NYTimes"
"92","2.629825","DN0a226530.SUNet","nuq04s29-in-f1.1e100.net","TCP","54","50823  >  http [ACK] Seq=1 Ack=1 Win=65536 Len=0","50823","80","10.34.101.48","216.58.192.1","10.34.101.48","00:00:0c:07:ac:37","NYTimes"
"93","2.629911","DN0a226530.SUNet","e5482.g.akamaiedge.net","TLSv1.2","253","Client Hello","50827","443","10.34.101.48","23.192.98.237","10.34.101.48","00:00:0c:07:ac:37","NYTimes"
"94","2.629916","DN0a226530.SUNet","e5482.g.akamaiedge.net","TCP","54","50829  >  https [ACK] Seq=1 Ack=1 Win=65536 Len=0","50829","443","10.34.101.48","23.192.98.237","10.34.101.48","00:00:0c:07:ac:37","NYTimes"
"95","2.630276","DN0a226530.SUNet","e5482.g.akamaiedge.net","TLSv1.2","253","Client Hello","50829","443","10.34.101.48","23.192.98.237","10.34.101.48","00:00:0c:07:ac:37","NYTimes"
"96","2.631816","e5482.g.akamaiedge.net","DN0a226530.SUNet","TCP","66","https  >  50828 [SYN, ACK] Seq=0 Ack=1 Win=29200 Len=0 MSS=1460 SACK_PERM=1 WS=32","443","50828","23.192.98.237","10.34.101.48","CiscoInc_ec:08:00","a0:a8:cd:44:9e:6d","NYTimes"
"97","2.631825","e5482.g.akamaiedge.net","DN0a226530.SUNet","TCP","66","https  >  50830 [SYN, ACK] Seq=0 Ack=1 Win=29200 Len=0 MSS=1460 SACK_PERM=1 WS=32","443","50830","23.192.98.237","10.34.101.48","CiscoInc_ec:08:00","a0:a8:cd:44:9e:6d","NYTimes"
"98","2.631825","e5482.g.akamaiedge.net","DN0a226530.SUNet","TCP","66","https  >  50832 [SYN, ACK] Seq=0 Ack=1 Win=29200 Len=0 MSS=1460 SACK_PERM=1 WS=32","443","50832","23.192.98.237","10.34.101.48","CiscoInc_ec:08:00","a0:a8:cd:44:9e:6d","NYTimes"
"99","2.631826","e5482.g.akamaiedge.net","DN0a226530.SUNet","TCP","66","https  >  50831 [SYN, ACK] Seq=0 Ack=1 Win=29200 Len=0 MSS=1460 SACK_PERM=1 WS=32","443","50831","23.192.98.237","10.34.101.48","CiscoInc_ec:08:00","a0:a8:cd:44:9e:6d","NYTimes"
"100","2.632395","DN0a226530.SUNet","e5482.g.akamaiedge.net","TCP","54","50828  >  https [ACK] Seq=1 Ack=1 Win=65536 Len=0","50828","443","10.34.101.48","23.192.98.237","10.34.101.48","00:00:0c:07:ac:37","NYTimes"
"101","2.632574","DN0a226530.SUNet","e5482.g.akamaiedge.net","TCP","54","50830  >  https [ACK] Seq=1 Ack=1 Win=65536 Len=0","50830","443","10.34.101.48","23.192.98.237","10.34.101.48","00:00:0c:07:ac:37","NYTimes"
"102","2.632639","DN0a226530.SUNet","e5482.g.akamaiedge.net","TLSv1.2","253","Client Hello","50828","443","10.34.101.48","23.192.98.237","10.34.101.48","00:00:0c:07:ac:37","NYTimes"
"103","2.632647","DN0a226530.SUNet","e5482.g.akamaiedge.net","TCP","54","50832  >  https [ACK] Seq=1 Ack=1 Win=65536 Len=0","50832","443","10.34.101.48","23.192.98.237","10.34.101.48","00:00:0c:07:ac:37","NYTimes"
"104","2.632700","DN0a226530.SUNet","e5482.g.akamaiedge.net","TCP","54","50831  >  https [ACK] Seq=1 Ack=1 Win=65536 Len=0","50831","443","10.34.101.48","23.192.98.237","10.34.101.48","00:00:0c:07:ac:37","NYTimes"
"105","2.633119","DN0a226530.SUNet","e5482.g.akamaiedge.net","TLSv1.2","571","Client Hello","50830","443","10.34.101.48","23.192.98.237","10.34.101.48","00:00:0c:07:ac:37","NYTimes"
"106","2.633510","DN0a226530.SUNet","e5482.g.akamaiedge.net","TLSv1.2","571","Client Hello","50832","443","10.34.101.48","23.192.98.237","10.34.101.48","00:00:0c:07:ac:37","NYTimes"
"107","2.633801","e5482.g.akamaiedge.net","DN0a226530.SUNet","TCP","54","https  >  50829 [ACK] Seq=1 Ack=200 Win=30272 Len=0","443","50829","23.192.98.237","10.34.101.48","CiscoInc_ec:08:00","a0:a8:cd:44:9e:6d","NYTimes"
"108","2.633996","DN0a226530.SUNet","e5482.g.akamaiedge.net","TLSv1.2","571","Client Hello","50831","443","10.34.101.48","23.192.98.237","10.34.101.48","00:00:0c:07:ac:37","NYTimes"
"109","2.635561","DN0a226530.SUNet","ec2-52-87-200-50.compute-1.amazonaws.com","TCP","1514","[TCP segment of a reassembled PDU]","50771","443","10.34.101.48","52.87.200.50","10.34.101.48","00:00:0c:07:ac:37","NYTimes"
"110","2.635570","DN0a226530.SUNet","ec2-52-87-200-50.compute-1.amazonaws.com","TLSv1.2","496","Application Data","50771","443","10.34.101.48","52.87.200.50","10.34.101.48","00:00:0c:07:ac:37","NYTimes"
"111","2.635684","e5482.g.akamaiedge.net","DN0a226530.SUNet","TCP","54","https  >  50827 [ACK] Seq=1 Ack=200 Win=30272 Len=0","443","50827","23.192.98.237","10.34.101.48","CiscoInc_ec:08:00","a0:a8:cd:44:9e:6d","NYTimes"
"112","2.635684","e5482.g.akamaiedge.net","DN0a226530.SUNet","TLSv1.2","1514","Server Hello","443","50829","23.192.98.237","10.34.101.48","CiscoInc_ec:08:00","a0:a8:cd:44:9e:6d","NYTimes"
"113","2.636603","e5482.g.akamaiedge.net","DN0a226530.SUNet","TCP","1514","[TCP segment of a reassembled PDU]","443","50829","23.192.98.237","10.34.101.48","CiscoInc_ec:08:00","a0:a8:cd:44:9e:6d","NYTimes"
"114","2.636605","e5482.g.akamaiedge.net","DN0a226530.SUNet","TLSv1.2","1514","Server Hello","443","50827","23.192.98.237","10.34.101.48","CiscoInc_ec:08:00","a0:a8:cd:44:9e:6d","NYTimes"
"115","2.636605","e5482.g.akamaiedge.net","DN0a226530.SUNet","TLSv1.2","1344","Certificate","443","50829","23.192.98.237","10.34.101.48","CiscoInc_ec:08:00","a0:a8:cd:44:9e:6d","NYTimes"
"116","2.636606","e5482.g.akamaiedge.net","DN0a226530.SUNet","TCP","1514","[TCP segment of a reassembled PDU]","443","50827","23.192.98.237","10.34.101.48","CiscoInc_ec:08:00","a0:a8:cd:44:9e:6d","NYTimes"
"117","2.636607","e5482.g.akamaiedge.net","DN0a226530.SUNet","TLSv1.2","1344","Certificate","443","50827","23.192.98.237","10.34.101.48","CiscoInc_ec:08:00","a0:a8:cd:44:9e:6d","NYTimes"
"118","2.636632","DN0a226530.SUNet","e5482.g.akamaiedge.net","TCP","54","50829  >  https [ACK] Seq=200 Ack=4211 Win=65536 Len=0","50829","443","10.34.101.48","23.192.98.237","10.34.101.48","00:00:0c:07:ac:37","NYTimes"
"119","2.636665","DN0a226530.SUNet","e5482.g.akamaiedge.net","TCP","54","50827  >  https [ACK] Seq=200 Ack=4211 Win=65536 Len=0","50827","443","10.34.101.48","23.192.98.237","10.34.101.48","00:00:0c:07:ac:37","NYTimes"
"121","2.637808","e5482.g.akamaiedge.net","DN0a226530.SUNet","TCP","54","https  >  50828 [ACK] Seq=1 Ack=200 Win=30272 Len=0","443","50828","23.192.98.237","10.34.101.48","CiscoInc_ec:08:00","a0:a8:cd:44:9e:6d","NYTimes"
"122","2.638828","DN0a226530.SUNet","e5482.g.akamaiedge.net","TLSv1.2","180","Client Key Exchange, Change Cipher Spec, Hello Request, Hello Request","50829","443","10.34.101.48","23.192.98.237","10.34.101.48","00:00:0c:07:ac:37","NYTimes"
"123","2.638966","e5482.g.akamaiedge.net","DN0a226530.SUNet","TCP","54","https  >  50830 [ACK] Seq=1 Ack=518 Win=30272 Len=0","443","50830","23.192.98.237","10.34.101.48","CiscoInc_ec:08:00","a0:a8:cd:44:9e:6d","NYTimes"
"124","2.638966","e5482.g.akamaiedge.net","DN0a226530.SUNet","TCP","54","https  >  50832 [ACK] Seq=1 Ack=518 Win=30272 Len=0","443","50832","23.192.98.237","10.34.101.48","CiscoInc_ec:08:00","a0:a8:cd:44:9e:6d","NYTimes"
"125","2.638966","e5482.g.akamaiedge.net","DN0a226530.SUNet","TCP","54","https  >  50831 [ACK] Seq=1 Ack=518 Win=30272 Len=0","443","50831","23.192.98.237","10.34.101.48","CiscoInc_ec:08:00","a0:a8:cd:44:9e:6d","NYTimes"
"126","2.638967","e5482.g.akamaiedge.net","DN0a226530.SUNet","TLSv1.2","206","Server Hello, Change Cipher Spec, Encrypted Handshake Message","443","50830","23.192.98.237","10.34.101.48","CiscoInc_ec:08:00","a0:a8:cd:44:9e:6d","NYTimes"
"127","2.638967","e5482.g.akamaiedge.net","DN0a226530.SUNet","TLSv1.2","206","Server Hello, Change Cipher Spec, Encrypted Handshake Message","443","50831","23.192.98.237","10.34.101.48","CiscoInc_ec:08:00","a0:a8:cd:44:9e:6d","NYTimes"
"128","2.638967","e5482.g.akamaiedge.net","DN0a226530.SUNet","TLSv1.2","206","Server Hello, Change Cipher Spec, Encrypted Handshake Message","443","50832","23.192.98.237","10.34.101.48","CiscoInc_ec:08:00","a0:a8:cd:44:9e:6d","NYTimes"
"129","2.638967","e5482.g.akamaiedge.net","DN0a226530.SUNet","TLSv1.2","1514","Server Hello","443","50828","23.192.98.237","10.34.101.48","CiscoInc_ec:08:00","a0:a8:cd:44:9e:6d","NYTimes"
"130","2.640036","e5482.g.akamaiedge.net","DN0a226530.SUNet","TCP","1514","[TCP segment of a reassembled PDU]","443","50828","23.192.98.237","10.34.101.48","CiscoInc_ec:08:00","a0:a8:cd:44:9e:6d","NYTimes"
"131","2.640037","e5482.g.akamaiedge.net","DN0a226530.SUNet","TLSv1.2","1344","Certificate","443","50828","23.192.98.237","10.34.101.48","CiscoInc_ec:08:00","a0:a8:cd:44:9e:6d","NYTimes"
"132","2.640056","DN0a226530.SUNet","e5482.g.akamaiedge.net","TCP","54","50828  >  https [ACK] Seq=200 Ack=4211 Win=65536 Len=0","50828","443","10.34.101.48","23.192.98.237","10.34.101.48","00:00:0c:07:ac:37","NYTimes"
"133","2.641099","DN0a226530.SUNet","e5482.g.akamaiedge.net","TLSv1.2","180","Client Key Exchange, Change Cipher Spec, Hello Request, Hello Request","50827","443","10.34.101.48","23.192.98.237","10.34.101.48","00:00:0c:07:ac:37","NYTimes"
"134","2.643238","DN0a226530.SUNet","e5482.g.akamaiedge.net","TLSv1.2","180","Client Key Exchange, Change Cipher Spec, Hello Request, Hello Request","50828","443","10.34.101.48","23.192.98.237","10.34.101.48","00:00:0c:07:ac:37","NYTimes"
"135","2.643321","e5482.g.akamaiedge.net","DN0a226530.SUNet","TLSv1.2","296","New Session Ticket, Change Cipher Spec, Encrypted Handshake Message","443","50829","23.192.98.237","10.34.101.48","CiscoInc_ec:08:00","a0:a8:cd:44:9e:6d","NYTimes"
"136","2.643490","DN0a226530.SUNet","e5482.g.akamaiedge.net","TLSv1.2","105","Change Cipher Spec, Hello Request, Hello Request","50832","443","10.34.101.48","23.192.98.237","10.34.101.48","00:00:0c:07:ac:37","NYTimes"
"137","2.643727","DN0a226530.SUNet","e5482.g.akamaiedge.net","TLSv1.2","105","Change Cipher Spec, Hello Request, Hello Request","50831","443","10.34.101.48","23.192.98.237","10.34.101.48","00:00:0c:07:ac:37","NYTimes"
"138","2.643796","d3cxgjorprur2q.cloudfront.net","DN0a226530.SUNet","TCP","66","http  >  50835 [SYN, ACK] Seq=0 Ack=1 Win=14600 Len=0 MSS=1460 SACK_PERM=1 WS=256","80","50835","52.84.22.220","10.34.101.48","CiscoInc_ec:08:00","a0:a8:cd:44:9e:6d","NYTimes"
"139","2.643847","DN0a226530.SUNet","d3cxgjorprur2q.cloudfront.net","TCP","54","50835  >  http [ACK] Seq=1 Ack=1 Win=65536 Len=0","50835","80","10.34.101.48","52.84.22.220","10.34.101.48","00:00:0c:07:ac:37","NYTimes"
"140","2.643962","DN0a226530.SUNet","e5482.g.akamaiedge.net","TLSv1.2","105","Change Cipher Spec, Hello Request, Hello Request","50830","443","10.34.101.48","23.192.98.237","10.34.101.48","00:00:0c:07:ac:37","NYTimes"
"141","2.645288","d3cxgjorprur2q.cloudfront.net","DN0a226530.SUNet","TCP","66","http  >  50837 [SYN, ACK] Seq=0 Ack=1 Win=14600 Len=0 MSS=1460 SACK_PERM=1 WS=256","80","50837","52.84.22.220","10.34.101.48","CiscoInc_ec:08:00","a0:a8:cd:44:9e:6d","NYTimes"
"142","2.645288","d3cxgjorprur2q.cloudfront.net","DN0a226530.SUNet","TCP","66","http  >  50836 [SYN, ACK] Seq=0 Ack=1 Win=14600 Len=0 MSS=1460 SACK_PERM=1 WS=256","80","50836","52.84.22.220","10.34.101.48","CiscoInc_ec:08:00","a0:a8:cd:44:9e:6d","NYTimes"
"143","2.645289","d3cxgjorprur2q.cloudfront.net","DN0a226530.SUNet","TCP","66","http  >  50838 [SYN, ACK] Seq=0 Ack=1 Win=14600 Len=0 MSS=1460 SACK_PERM=1 WS=256","80","50838","52.84.22.220","10.34.101.48","CiscoInc_ec:08:00","a0:a8:cd:44:9e:6d","NYTimes"
"144","2.645289","d3cxgjorprur2q.cloudfront.net","DN0a226530.SUNet","TCP","66","http  >  50840 [SYN, ACK] Seq=0 Ack=1 Win=14600 Len=0 MSS=1460 SACK_PERM=1 WS=256","80","50840","52.84.22.220","10.34.101.48","CiscoInc_ec:08:00","a0:a8:cd:44:9e:6d","NYTimes"
"145","2.645290","d3cxgjorprur2q.cloudfront.net","DN0a226530.SUNet","TCP","66","http  >  50839 [SYN, ACK] Seq=0 Ack=1 Win=14600 Len=0 MSS=1460 SACK_PERM=1 WS=256","80","50839","52.84.22.220","10.34.101.48","CiscoInc_ec:08:00","a0:a8:cd:44:9e:6d","NYTimes"
"146","2.645294","DN0a226530.SUNet","iron.stanford.edu","DNS","76","Standard query 0xf170 A s3.amazonaws.com","64878","53","10.34.101.48","171.67.1.234","10.34.101.48","00:00:0c:07:ac:37","NYTimes"
"147","2.645483","DN0a226530.SUNet","d3cxgjorprur2q.cloudfront.net","TCP","54","50837  >  http [ACK] Seq=1 Ack=1 Win=65536 Len=0","50837","80","10.34.101.48","52.84.22.220","10.34.101.48","00:00:0c:07:ac:37","NYTimes"
"148","2.645535","DN0a226530.SUNet","d3cxgjorprur2q.cloudfront.net","TCP","54","50836  >  http [ACK] Seq=1 Ack=1 Win=65536 Len=0","50836","80","10.34.101.48","52.84.22.220","10.34.101.48","00:00:0c:07:ac:37","NYTimes"
"149","2.645569","DN0a226530.SUNet","d3cxgjorprur2q.cloudfront.net","TCP","54","50838  >  http [ACK] Seq=1 Ack=1 Win=65536 Len=0","50838","80","10.34.101.48","52.84.22.220","10.34.101.48","00:00:0c:07:ac:37","NYTimes"
"150","2.645605","DN0a226530.SUNet","d3cxgjorprur2q.cloudfront.net","TCP","54","50840  >  http [ACK] Seq=1 Ack=1 Win=65536 Len=0","50840","80","10.34.101.48","52.84.22.220","10.34.101.48","00:00:0c:07:ac:37","NYTimes"
"151","2.645635","DN0a226530.SUNet","d3cxgjorprur2q.cloudfront.net","TCP","54","50839  >  http [ACK] Seq=1 Ack=1 Win=65536 Len=0","50839","80","10.34.101.48","52.84.22.220","10.34.101.48","00:00:0c:07:ac:37","NYTimes"
"152","2.647670","e5482.g.akamaiedge.net","DN0a226530.SUNet","TLSv1.2","296","New Session Ticket, Change Cipher Spec, Encrypted Handshake Message","443","50827","23.192.98.237","10.34.101.48","CiscoInc_ec:08:00","a0:a8:cd:44:9e:6d","NYTimes"
"153","2.647672","ec2-54-69-167-143.us-west-2.compute.amazonaws.com","DN0a226530.SUNet","TCP","66","http  >  50818 [SYN, ACK] Seq=0 Ack=1 Win=17922 Len=0 MSS=8961 SACK_PERM=1 WS=256","80","50818","54.69.167.143","10.34.101.48","CiscoInc_ec:08:00","a0:a8:cd:44:9e:6d","NYTimes"
"154","2.647672","ec2-54-69-167-143.us-west-2.compute.amazonaws.com","DN0a226530.SUNet","TCP","66","http  >  50817 [SYN, ACK] Seq=0 Ack=1 Win=17922 Len=0 MSS=8961 SACK_PERM=1 WS=256","80","50817","54.69.167.143","10.34.101.48","CiscoInc_ec:08:00","a0:a8:cd:44:9e:6d","NYTimes"
"155","2.648072","DN0a226530.SUNet","ec2-54-69-167-143.us-west-2.compute.amazonaws.com","TCP","54","50818  >  http [ACK] Seq=1 Ack=1 Win=65536 Len=0","50818","80","10.34.101.48","54.69.167.143","10.34.101.48","00:00:0c:07:ac:37","NYTimes"
"156","2.648208","DN0a226530.SUNet","ec2-54-69-167-143.us-west-2.compute.amazonaws.com","TCP","54","50817  >  http [ACK] Seq=1 Ack=1 Win=65536 Len=0","50817","80","10.34.101.48","54.69.167.143","10.34.101.48","00:00:0c:07:ac:37","NYTimes"
"157","2.650173","e5482.g.akamaiedge.net","DN0a226530.SUNet","TLSv1.2","296","New Session Ticket, Change Cipher Spec, Encrypted Handshake Message","443","50828","23.192.98.237","10.34.101.48","CiscoInc_ec:08:00","a0:a8:cd:44:9e:6d","NYTimes"
"158","2.686408","e5482.g.akamaiedge.net","DN0a226530.SUNet","TCP","54","https  >  50831 [ACK] Seq=153 Ack=569 Win=30272 Len=0","443","50831","23.192.98.237","10.34.101.48","CiscoInc_ec:08:00","a0:a8:cd:44:9e:6d","NYTimes"
"159","2.687239","e5482.g.akamaiedge.net","DN0a226530.SUNet","TCP","54","https  >  50832 [ACK] Seq=153 Ack=569 Win=30272 Len=0","443","50832","23.192.98.237","10.34.101.48","CiscoInc_ec:08:00","a0:a8:cd:44:9e:6d","NYTimes"
"160","2.687940","ice.stanford.edu","DN0a226530.SUNet","DNS","312","Standard query response 0xf170 A s3.amazonaws.com CNAME s3-1.amazonaws.com A 54.231.82.180 NS ns-1084.awsdns-07.org NS ns-1726.awsdns-23.co.uk NS ns-482.awsdns-60.com NS ns-782.awsdns-33.net A 205.251.193.226 A 205.251.195.14 A 205.251.196.60 A 205.251.198.190","53","64878","171.64.1.234","10.34.101.48","CiscoInc_ec:08:00","a0:a8:cd:44:9e:6d","NYTimes"
"161","2.687940","e5482.g.akamaiedge.net","DN0a226530.SUNet","TCP","54","https  >  50830 [ACK] Seq=153 Ack=569 Win=30272 Len=0","443","50830","23.192.98.237","10.34.101.48","CiscoInc_ec:08:00","a0:a8:cd:44:9e:6d","NYTimes"
"162","2.688429","DN0a226530.SUNet","s3-1.amazonaws.com","TCP","66","50841  >  http [SYN] Seq=0 Win=8192 Len=0 MSS=1460 WS=256 SACK_PERM=1","50841","80","10.34.101.48","54.231.82.180","10.34.101.48","00:00:0c:07:ac:37","NYTimes"
"163","2.688595","DN0a226530.SUNet","s3-1.amazonaws.com","TCP","66","50842  >  http [SYN] Seq=0 Win=8192 Len=0 MSS=1460 WS=256 SACK_PERM=1","50842","80","10.34.101.48","54.231.82.180","10.34.101.48","00:00:0c:07:ac:37","NYTimes"
"164","2.688700","DN0a226530.SUNet","s3-1.amazonaws.com","TCP","66","50843  >  http [SYN] Seq=0 Win=8192 Len=0 MSS=1460 WS=256 SACK_PERM=1","50843","80","10.34.101.48","54.231.82.180","10.34.101.48","00:00:0c:07:ac:37","NYTimes"
"165","2.693256","DN0a226530.SUNet","e5482.g.akamaiedge.net","TCP","54","50829  >  https [ACK] Seq=326 Ack=4453 Win=65280 Len=0","50829","443","10.34.101.48","23.192.98.237","10.34.101.48","00:00:0c:07:ac:37","NYTimes"
"166","2.701621","DN0a226530.SUNet","e5482.g.akamaiedge.net","TCP","54","50827  >  https [ACK] Seq=326 Ack=4453 Win=65280 Len=0","50827","443","10.34.101.48","23.192.98.237","10.34.101.48","00:00:0c:07:ac:37","NYTimes"
"167","2.701622","DN0a226530.SUNet","e5482.g.akamaiedge.net","TCP","54","50828  >  https [ACK] Seq=326 Ack=4453 Win=65280 Len=0","50828","443","10.34.101.48","23.192.98.237","10.34.101.48","00:00:0c:07:ac:37","NYTimes"
"168","2.702541","ec2-23-23-248-17.compute-1.amazonaws.com","DN0a226530.SUNet","TCP","66","http  >  50821 [SYN, ACK] Seq=0 Ack=1 Win=14600 Len=0 MSS=1460 SACK_PERM=1 WS=256","80","50821","23.23.248.17","10.34.101.48","CiscoInc_ec:08:00","a0:a8:cd:44:9e:6d","NYTimes"
"169","2.702592","DN0a226530.SUNet","ec2-23-23-248-17.compute-1.amazonaws.com","TCP","54","50821  >  http [ACK] Seq=1 Ack=1 Win=65536 Len=0","50821","80","10.34.101.48","23.23.248.17","10.34.101.48","00:00:0c:07:ac:37","NYTimes"
"170","2.703602","ec2-23-23-248-17.compute-1.amazonaws.com","DN0a226530.SUNet","TCP","66","http  >  50820 [SYN, ACK] Seq=0 Ack=1 Win=14600 Len=0 MSS=1460 SACK_PERM=1 WS=256","80","50820","23.23.248.17","10.34.101.48","CiscoInc_ec:08:00","a0:a8:cd:44:9e:6d","NYTimes"
"171","2.703658","DN0a226530.SUNet","ec2-23-23-248-17.compute-1.amazonaws.com","TCP","54","50820  >  http [ACK] Seq=1 Ack=1 Win=65536 Len=0","50820","80","10.34.101.48","23.23.248.17","10.34.101.48","00:00:0c:07:ac:37","NYTimes"
"172","2.705669","ec2-52-87-200-50.compute-1.amazonaws.com","DN0a226530.SUNet","TCP","66","https  >  50833 [SYN, ACK] Seq=0 Ack=1 Win=26883 Len=0 MSS=8961 SACK_PERM=1 WS=128","443","50833","52.87.200.50","10.34.101.48","CiscoInc_ec:08:00","a0:a8:cd:44:9e:6d","NYTimes"
"173","2.705731","DN0a226530.SUNet","ec2-52-87-200-50.compute-1.amazonaws.com","TCP","54","50833  >  https [ACK] Seq=1 Ack=1 Win=65536 Len=0","50833","443","10.34.101.48","52.87.200.50","10.34.101.48","00:00:0c:07:ac:37","NYTimes"
"174","2.705912","DN0a226530.SUNet","ec2-52-87-200-50.compute-1.amazonaws.com","TLSv1.2","571","Client Hello","50833","443","10.34.101.48","52.87.200.50","10.34.101.48","00:00:0c:07:ac:37","NYTimes"
"175","2.708627","ec2-52-87-200-50.compute-1.amazonaws.com","DN0a226530.SUNet","TCP","66","https  >  50834 [SYN, ACK] Seq=0 Ack=1 Win=26883 Len=0 MSS=8961 SACK_PERM=1 WS=128","443","50834","52.87.200.50","10.34.101.48","CiscoInc_ec:08:00","a0:a8:cd:44:9e:6d","NYTimes"
"176","2.708683","DN0a226530.SUNet","ec2-52-87-200-50.compute-1.amazonaws.com","TCP","54","50834  >  https [ACK] Seq=1 Ack=1 Win=65536 Len=0","50834","443","10.34.101.48","52.87.200.50","10.34.101.48","00:00:0c:07:ac:37","NYTimes"
"177","2.708818","DN0a226530.SUNet","ec2-52-87-200-50.compute-1.amazonaws.com","TLSv1.2","571","Client Hello","50834","443","10.34.101.48","52.87.200.50","10.34.101.48","00:00:0c:07:ac:37","NYTimes"
"178","2.727306","ec2-52-87-200-50.compute-1.amazonaws.com","DN0a226530.SUNet","TCP","54","https  >  50771 [ACK] Seq=1 Ack=1903 Win=332 Len=0","443","50771","52.87.200.50","10.34.101.48","CiscoInc_ec:08:00","a0:a8:cd:44:9e:6d","NYTimes"
"179","2.728698","ec2-52-87-200-50.compute-1.amazonaws.com","DN0a226530.SUNet","TLSv1.2","395","Application Data","443","50771","52.87.200.50","10.34.101.48","CiscoInc_ec:08:00","a0:a8:cd:44:9e:6d","NYTimes"
"180","2.769702","s3-1.amazonaws.com","DN0a226530.SUNet","TCP","66","http  >  50843 [SYN, ACK] Seq=0 Ack=1 Win=8192 Len=0 MSS=1432 WS=256 SACK_PERM=1","80","50843","54.231.82.180","10.34.101.48","CiscoInc_ec:08:00","a0:a8:cd:44:9e:6d","NYTimes"
"181","2.769776","DN0a226530.SUNet","s3-1.amazonaws.com","TCP","54","50843  >  http [ACK] Seq=1 Ack=1 Win=65792 Len=0","50843","80","10.34.101.48","54.231.82.180","10.34.101.48","00:00:0c:07:ac:37","NYTimes"
"182","2.772356","DN0a226530.SUNet","ec2-52-87-200-50.compute-1.amazonaws.com","TCP","54","50771  >  https [ACK] Seq=1903 Ack=342 Win=256 Len=0","50771","443","10.34.101.48","52.87.200.50","10.34.101.48","00:00:0c:07:ac:37","NYTimes"
"183","2.773179","s3-1.amazonaws.com","DN0a226530.SUNet","TCP","66","http  >  50842 [SYN, ACK] Seq=0 Ack=1 Win=8192 Len=0 MSS=1432 WS=256 SACK_PERM=1","80","50842","54.231.82.180","10.34.101.48","CiscoInc_ec:08:00","a0:a8:cd:44:9e:6d","NYTimes"
"184","2.773261","DN0a226530.SUNet","s3-1.amazonaws.com","TCP","54","50842  >  http [ACK] Seq=1 Ack=1 Win=65792 Len=0","50842","80","10.34.101.48","54.231.82.180","10.34.101.48","00:00:0c:07:ac:37","NYTimes"
"185","2.775135","s3-1.amazonaws.com","DN0a226530.SUNet","TCP","66","http  >  50841 [SYN, ACK] Seq=0 Ack=1 Win=8192 Len=0 MSS=1432 WS=256 SACK_PERM=1","80","50841","54.231.82.180","10.34.101.48","CiscoInc_ec:08:00","a0:a8:cd:44:9e:6d","NYTimes"
"186","2.775164","DN0a226530.SUNet","s3-1.amazonaws.com","TCP","54","50841  >  http [ACK] Seq=1 Ack=1 Win=65792 Len=0","50841","80","10.34.101.48","54.231.82.180","10.34.101.48","00:00:0c:07:ac:37","NYTimes"
"187","2.789054","ec2-52-87-200-50.compute-1.amazonaws.com","DN0a226530.SUNet","TCP","54","https  >  50833 [ACK] Seq=1 Ack=518 Win=28032 Len=0","443","50833","52.87.200.50","10.34.101.48","CiscoInc_ec:08:00","a0:a8:cd:44:9e:6d","NYTimes"
"188","2.789055","ec2-52-87-200-50.compute-1.amazonaws.com","DN0a226530.SUNet","TLSv1.2","206","Server Hello, Change Cipher Spec, Encrypted Handshake Message","443","50833","52.87.200.50","10.34.101.48","CiscoInc_ec:08:00","a0:a8:cd:44:9e:6d","NYTimes"
"189","2.789213","DN0a226530.SUNet","ec2-52-87-200-50.compute-1.amazonaws.com","TLSv1.2","105","Change Cipher Spec, Hello Request, Hello Request","50833","443","10.34.101.48","52.87.200.50","10.34.101.48","00:00:0c:07:ac:37","NYTimes"
"190","2.795417","ec2-52-87-200-50.compute-1.amazonaws.com","DN0a226530.SUNet","TCP","54","https  >  50834 [ACK] Seq=1 Ack=518 Win=28032 Len=0","443","50834","52.87.200.50","10.34.101.48","CiscoInc_ec:08:00","a0:a8:cd:44:9e:6d","NYTimes"
"191","2.795417","ec2-52-87-200-50.compute-1.amazonaws.com","DN0a226530.SUNet","TLSv1.2","206","Server Hello, Change Cipher Spec, Encrypted Handshake Message","443","50834","52.87.200.50","10.34.101.48","CiscoInc_ec:08:00","a0:a8:cd:44:9e:6d","NYTimes"
